{
  "custom": {
    "clusters": [
      "components-by-tag/form"
    ],
    "frameworks": {
      "angular": {
        "componentName": "SynRadioComponent",
        "exportPath": "packages/angular/index.ts",
        "packageName": "@synergy-design-system/angular",
        "selector": "syn-radio",
        "sourcePath": "packages/angular/components/radio/radio.component.ts"
      },
      "react": {
        "jsx": {
          "componentName": "SynRadio",
          "documentation": "https://synergy-design-system.github.io/?path=/docs/components-syn-radio--docs",
          "events": [
            {
              "name": "syn-blur",
              "type": "SynBlurEvent"
            },
            {
              "name": "syn-focus",
              "type": "SynFocusEvent"
            }
          ],
          "packageName": "@synergy-design-system/react",
          "since": "1.0.0",
          "sourcePath": "packages/react/src/types/syn-jsx-elements.ts",
          "status": "stable",
          "subpathExport": "./types/latest",
          "typeName": "SynRadioJSXElement"
        },
        "wrapper": {
          "componentName": "SynRadio",
          "exportPath": "packages/react/src/index.ts",
          "packageName": "@synergy-design-system/react",
          "sourcePath": "packages/react/src/components/radio.ts"
        }
      },
      "vue": {
        "componentName": "SynVueRadio",
        "exportPath": "packages/vue/src/index.ts",
        "packageName": "@synergy-design-system/vue",
        "sourcePath": "packages/vue/src/components/SynVueRadio.vue"
      }
    },
    "override": {
      "figmaComponentId": "1345-21578",
      "figmaDocsId": "41310-252390",
      "stories": [
        {
          "description": {
            "type": "text",
            "value": "Radios allow the user to select a single option from a group. \\nRadios are designed to be used with radio groups."
          },
          "name": "default",
          "title": {
            "type": "text",
            "value": "Radio"
          }
        },
        {
          "description": {
            "type": "text",
            "value": "The focus event gives the user feedback that the Radio has been focused by the keyboard interaction."
          },
          "name": "focus",
          "title": {
            "type": "text",
            "value": "Focus"
          }
        },
        {
          "description": {
            "type": "text",
            "value": "Set disabled on an unavailable radio option and explain why it cannot be selected. Use readonly on every radio in the group when users should inspect the selection without changing it."
          },
          "name": "disabled",
          "title": {
            "type": "text",
            "value": "Disabled"
          }
        },
        {
          "description": {
            "type": "text",
            "value": "Set readonly on every syn-radio in the group when users should inspect the selected choice without changing it. Setting it only on the selected radio leaves other choices available."
          },
          "name": "readonly",
          "title": {
            "type": "text",
            "value": "Read-only"
          }
        },
        {
          "description": {
            "type": "text",
            "value": "Add the size attribute to the Radio Group to change the radios’ size."
          },
          "name": "sizes",
          "title": {
            "type": "text",
            "value": "Sizes"
          }
        },
        {
          "description": {
            "type": "text",
            "value": "The invalid status is used to warn the user that the Radio is invalid. For example, if the radio is mandatory and nothing has been checked."
          },
          "name": "invalid",
          "title": {
            "type": "text",
            "value": "Invalid"
          }
        },
        {
          "description": {
            "type": "text",
            "value": "To set the initial value and checked state, use the value attribute on the radio element."
          },
          "name": "initialValue",
          "title": {
            "type": "text",
            "value": "Initial Value"
          }
        }
      ],
      "storySourcePath": "components.radio",
      "storyTags": [
        "Form"
      ]
    },
    "rules": {
      "accessibility": [
        "syn-radio is not a standalone control; always use syn-radio inside syn-radio-group so assistive technologies can interpret options as one exclusive choice set.",
        "Ensure each radio has a clear, unique visible label; avoid ambiguous labels such as \"Option 1\" without context.",
        "Use disabled or readonly states only when users can still understand why an option is unavailable."
      ],
      "component": "syn-radio",
      "related": {
        "components": [
          "syn-radio-group"
        ],
        "templates": [
          "Forms"
        ]
      },
      "usageGuidelines": [
        {
          "content": [
            "Do not use syn-radio on its own; slot it into syn-radio-group to get correct keyboard behavior, semantics, and form participation.",
            "Use radios when users must select exactly one option from a small, predefined list.",
            "Keep options mutually exclusive and avoid overlapping meanings between choices.",
            "Present options in a stable order and keep wording parallel to make comparison easier."
          ],
          "id": "option_structure",
          "name": "Option Structure"
        },
        {
          "content": [
            "Always provide a meaningful group label on the parent syn-radio-group.",
            "Use concise option labels and add help text when options need extra explanation.",
            "Prefer sentence case and domain terms users already know."
          ],
          "id": "labels_and_guidance",
          "name": "Labels and Guidance"
        },
        {
          "content": [
            "Set a sensible default when one option is expected in most cases, but avoid preselecting high-risk choices.",
            "If no safe default exists, require explicit user selection before submit.",
            "Do not mix radios and checkboxes for the same decision set."
          ],
          "id": "selection_behavior",
          "name": "Selection Behavior"
        },
        {
          "content": [
            "Use readonly on every radio in a group when users should see the current selection without changing it; setting it only on the selected radio leaves other options available.",
            "Use disabled on individual radios only when those choices are unavailable, and explain why they cannot be selected."
          ],
          "id": "states",
          "name": "Validation and States"
        }
      ],
      "useCases": [
        "Choose one delivery method from a short list.",
        "Select one billing frequency such as monthly or yearly.",
        "Pick one preference in settings where only a single active mode is allowed.",
        "Answer single-choice questions in forms and surveys."
      ]
    },
    "sourceModulePath": "components/radio/radio.js",
    "summary": "Radios allow the user to select a single option from a group."
  },
  "id": "component:syn-radio",
  "kind": "component",
  "layers": {
    "examples": [
      {
        "layer": "examples",
        "path": "layers/examples/component/component__syn-radio.md"
      }
    ],
    "full": [
      {
        "layer": "full",
        "path": "layers/full/component/component__syn-radio/angular/radio.component.ts"
      },
      {
        "layer": "full",
        "path": "layers/full/component/component__syn-radio/components/radio.component.ts"
      },
      {
        "layer": "full",
        "path": "layers/full/component/component__syn-radio/components/radio.styles.ts"
      },
      {
        "layer": "full",
        "path": "layers/full/component/component__syn-radio/components/radio.ts"
      },
      {
        "layer": "full",
        "path": "layers/full/component/component__syn-radio/react/radio.ts"
      },
      {
        "layer": "full",
        "path": "layers/full/component/component__syn-radio/vue/SynVueRadio.vue"
      },
      {
        "layer": "full",
        "path": "layers/full/component/component__syn-radio/react/SynRadioJSXElement.ts"
      }
    ],
    "interface": [
      {
        "layer": "interface",
        "path": "layers/interface/component/component__syn-radio.json"
      },
      {
        "layer": "interface",
        "path": "layers/interface/component/component__syn-radio.md"
      }
    ],
    "rules": [
      {
        "layer": "rules",
        "path": "layers/rules/component/component__syn-radio.md"
      }
    ]
  },
  "name": "syn-radio",
  "package": "components",
  "relations": [
    {
      "id": "component:syn-icon",
      "type": "dependsOn"
    }
  ],
  "since": "1.0.0",
  "sources": [
    "packages/angular/components/radio/radio.component.ts",
    "packages/components/src/components/radio/radio.component.ts",
    "packages/components/src/components/radio/radio.styles.ts",
    "packages/components/src/components/radio/radio.ts",
    "packages/react/src/components/radio.ts",
    "packages/vue/src/components/SynVueRadio.vue"
  ],
  "status": "stable",
  "tags": [
    "angular",
    "component",
    "radio",
    "react",
    "syn-radio",
    "vue"
  ]
}
