{
  "custom": {
    "moduleName": "tables"
  },
  "id": "style:syn-table",
  "kind": "style",
  "layers": {
    "examples": [
      {
        "layer": "examples",
        "path": "layers/examples/style/style:syn-table.md"
      }
    ],
    "full": [
      {
        "layer": "full",
        "path": "layers/full/styles/tables/table.css"
      }
    ]
  },
  "name": "syn-table",
  "package": "styles",
  "relations": [],
  "since": "2.2.0",
  "sources": [
    "packages/styles/src/tables/table.css"
  ],
  "status": "stable",
  "tags": [
    "module",
    "style",
    "styles",
    "syn-table",
    "table",
    "tables"
  ]
}
