{
  "custom": {
    "clusters": [
      "components-by-tag/navigation"
    ],
    "frameworks": {
      "angular": {
        "componentName": "SynPrioNavComponent",
        "exportPath": "packages/angular/index.ts",
        "packageName": "@synergy-design-system/angular",
        "selector": "syn-prio-nav",
        "sourcePath": "packages/angular/components/prio-nav/prio-nav.component.ts"
      },
      "react": {
        "jsx": {
          "componentName": "SynPrioNav",
          "documentation": "https://synergy-design-system.github.io/?path=/docs/components-syn-prio-nav--docs",
          "events": [],
          "packageName": "@synergy-design-system/react",
          "since": "1.15.0",
          "sourcePath": "packages/react/src/types/syn-jsx-elements.ts",
          "status": "stable",
          "subpathExport": "./types/latest",
          "typeName": "SynPrioNavJSXElement"
        },
        "wrapper": {
          "componentName": "SynPrioNav",
          "exportPath": "packages/react/src/index.ts",
          "packageName": "@synergy-design-system/react",
          "sourcePath": "packages/react/src/components/prio-nav.ts"
        }
      },
      "vue": {
        "componentName": "SynVuePrioNav",
        "exportPath": "packages/vue/src/index.ts",
        "packageName": "@synergy-design-system/vue",
        "sourcePath": "packages/vue/src/components/SynVuePrioNav.vue"
      }
    },
    "override": {
      "figmaComponentId": "12362-10982",
      "figmaDocsId": "41227-206412",
      "stories": [
        {
          "description": {
            "type": "text",
            "value": "Priority navigation is supported as product navigation if required. This navigation layout provides a high level of findability and support so that users know where they are at all times and can ensure that they can easily reach their goals.\n\nNote: Please note that the priority navigation does not have a child menu navigation, if you want to have a child navigation, combine the priority navigation and the side navigation"
          },
          "name": "default",
          "title": {
            "type": "text",
            "value": "Priority Navigation"
          }
        },
        {
          "description": {
            "type": "text",
            "value": "If there is not enough space, elements will move into a dropdown. If there is only space for  one item, it will display the priority menu only."
          },
          "name": "priority-menu",
          "title": {
            "type": "text",
            "value": "Priority Menu"
          }
        }
      ],
      "storySourcePath": "components.prio-nav",
      "storyTags": [
        "Navigation"
      ]
    },
    "rules": {
      "accessibility": [
        "Ensure navigation items are keyboard reachable and ordered logically.",
        "Use clear labels that reflect destination and not internal naming.",
        "Communicate current location with proper active state semantics."
      ],
      "component": "syn-prio-nav",
      "related": {
        "components": [
          "syn-nav-item",
          "syn-menu",
          "syn-menu-item",
          "syn-header"
        ]
      },
      "usageGuidelines": [
        {
          "content": [
            "Place the most important destinations first so they stay visible longer.",
            "Move lower priority items into overflow menus when space is limited.",
            "Review priority order regularly as product usage evolves."
          ],
          "id": "priority",
          "name": "Priority Handling"
        },
        {
          "content": [
            "Keep labels short and distinct to prevent truncation and ambiguity.",
            "Avoid deep nesting in top level priority navigation.",
            "Use predictable ordering patterns such as task or category order."
          ],
          "id": "labels",
          "name": "Labels and Structure"
        },
        {
          "content": [
            "Test behavior at common breakpoints to ensure overflow remains usable.",
            "Ensure menu fallback remains discoverable on narrow viewports.",
            "Keep interaction patterns consistent between desktop and mobile."
          ],
          "id": "responsive",
          "name": "Responsive Behavior"
        }
      ],
      "useCases": [
        "Primary horizontal navigation with overflow handling.",
        "App headers that must adapt to changing viewport widths.",
        "Section navigation where top destinations should stay visible."
      ]
    },
    "sourceModulePath": "components/prio-nav/prio-nav.js",
    "summary": "The `<syn-prio-nav />` element provides a generic navigation bar\nthat can be used to group multiple navigation items  (usually horizontal `<syn-nav-item />`s)\ntogether. It will automatically group all items not visible in the viewport into a custom\npriority menu."
  },
  "id": "component:syn-prio-nav",
  "kind": "component",
  "layers": {
    "examples": [
      {
        "layer": "examples",
        "path": "layers/examples/component/component__syn-prio-nav.md"
      }
    ],
    "full": [
      {
        "layer": "full",
        "path": "layers/full/component/component__syn-prio-nav/angular/prio-nav.component.ts"
      },
      {
        "layer": "full",
        "path": "layers/full/component/component__syn-prio-nav/components/prio-nav.component.ts"
      },
      {
        "layer": "full",
        "path": "layers/full/component/component__syn-prio-nav/components/prio-nav.styles.ts"
      },
      {
        "layer": "full",
        "path": "layers/full/component/component__syn-prio-nav/components/prio-nav.ts"
      },
      {
        "layer": "full",
        "path": "layers/full/component/component__syn-prio-nav/components/utils.ts"
      },
      {
        "layer": "full",
        "path": "layers/full/component/component__syn-prio-nav/react/prio-nav.ts"
      },
      {
        "layer": "full",
        "path": "layers/full/component/component__syn-prio-nav/vue/SynVuePrioNav.vue"
      },
      {
        "layer": "full",
        "path": "layers/full/component/component__syn-prio-nav/react/SynPrioNavJSXElement.ts"
      }
    ],
    "interface": [
      {
        "layer": "interface",
        "path": "layers/interface/component/component__syn-prio-nav.json"
      },
      {
        "layer": "interface",
        "path": "layers/interface/component/component__syn-prio-nav.md"
      }
    ],
    "rules": [
      {
        "layer": "rules",
        "path": "layers/rules/component/component__syn-prio-nav.md"
      }
    ]
  },
  "name": "syn-prio-nav",
  "package": "components",
  "relations": [
    {
      "id": "component:syn-dropdown",
      "type": "dependsOn"
    },
    {
      "id": "component:syn-icon",
      "type": "dependsOn"
    },
    {
      "id": "component:syn-menu",
      "type": "dependsOn"
    },
    {
      "id": "component:syn-nav-item",
      "type": "dependsOn"
    }
  ],
  "since": "1.15.0",
  "sources": [
    "packages/angular/components/prio-nav/prio-nav.component.ts",
    "packages/components/src/components/prio-nav/prio-nav.component.ts",
    "packages/components/src/components/prio-nav/prio-nav.styles.ts",
    "packages/components/src/components/prio-nav/prio-nav.ts",
    "packages/components/src/components/prio-nav/utils.ts",
    "packages/react/src/components/prio-nav.ts",
    "packages/vue/src/components/SynVuePrioNav.vue"
  ],
  "status": "stable",
  "tags": [
    "angular",
    "component",
    "prio-nav",
    "react",
    "syn-prio-nav",
    "vue"
  ]
}
