{
  "custom": {
    "artifactPath": "themes/sick2018_dark.css",
    "format": "css",
    "sourceType": "dist",
    "theme": "sick2018-dark"
  },
  "id": "token:tokens-themes-sick2018-dark-css",
  "kind": "token",
  "layers": {
    "full": [
      {
        "layer": "full",
        "path": "layers/full/tokens/themes/sick2018_dark.css"
      }
    ]
  },
  "name": "sick2018_dark.css",
  "package": "tokens",
  "relations": [],
  "since": "3.29.1",
  "sources": [
    "packages/tokens/dist/themes/sick2018_dark.css"
  ],
  "status": "stable",
  "tags": [
    "artifact",
    "token",
    "tokens",
    "dist"
  ]
}
