{
  "custom": {
    "clusters": [
      "components-by-tag/feedback"
    ],
    "frameworks": {
      "angular": {
        "componentName": "SynSpinnerComponent",
        "exportPath": "packages/angular/index.ts",
        "packageName": "@synergy-design-system/angular",
        "selector": "syn-spinner",
        "sourcePath": "packages/angular/components/spinner/spinner.component.ts"
      },
      "react": {
        "jsx": {
          "componentName": "SynSpinner",
          "documentation": "https://synergy-design-system.github.io/?path=/docs/components-syn-spinner--docs",
          "events": [],
          "packageName": "@synergy-design-system/react",
          "since": "1.22.0",
          "sourcePath": "packages/react/src/types/syn-jsx-elements.ts",
          "status": "stable",
          "subpathExport": "./types/latest",
          "typeName": "SynSpinnerJSXElement"
        },
        "wrapper": {
          "componentName": "SynSpinner",
          "exportPath": "packages/react/src/index.ts",
          "packageName": "@synergy-design-system/react",
          "sourcePath": "packages/react/src/components/spinner.ts"
        }
      },
      "vue": {
        "componentName": "SynVueSpinner",
        "exportPath": "packages/vue/src/index.ts",
        "packageName": "@synergy-design-system/vue",
        "sourcePath": "packages/vue/src/components/SynVueSpinner.vue"
      }
    },
    "override": {
      "figmaComponentId": "17016-71772",
      "figmaDocsId": "41227-223775",
      "stories": [
        {
          "description": {
            "type": "text",
            "value": "Spinners are used to show the progress of an indeterminate operation."
          },
          "name": "default",
          "title": {
            "type": "text",
            "value": "Spinner"
          }
        },
        {
          "description": {
            "type": "text",
            "value": "Spinners are sized based on the current font size. To change their size, set the font-size property on the spinner itself or on a parent element as shown below."
          },
          "name": "size",
          "title": {
            "type": "text",
            "value": "Size"
          }
        },
        {
          "description": {
            "type": "text",
            "value": "The width of the spinner’s track can be changed by setting the --track-width custom property."
          },
          "name": "track-width",
          "title": {
            "type": "text",
            "value": "Track Width"
          }
        },
        {
          "description": {
            "type": "text",
            "value": "The spinner’s colors can be changed by setting the --indicator-color and --track-color custom properties."
          },
          "name": "color",
          "title": {
            "type": "text",
            "value": "Color"
          }
        }
      ],
      "storySourcePath": "components.spinner",
      "storyTags": [
        "Feedback"
      ]
    },
    "rules": {
      "accessibility": [
        "Assign role=\"status\" or use a live region (e.g., aria-live=\"polite\") to inform screen reader users of ongoing loading.",
        "A spinner shouldn't itself be focusable or interactive, nor prevent from navigating to other parts of the page while loading continues."
      ],
      "component": "syn-spinner",
      "knownIssues": [
        {
          "browser": "Safari",
          "description": "The spinner component may experience animation issues in Safari, causing it to appear wobbly."
        }
      ],
      "usageGuidelines": [
        {
          "content": [
            "Use for processes that take a short amount of time (typically under 4 seconds).",
            "Apply within specific sections rather than blocking the entire page, unless absolutely necessary.",
            "Place in a consistent location relative to the content it is loading."
          ],
          "id": "behavior_and_placement",
          "name": "Behavior and Placement"
        },
        {
          "content": [
            "Include a label or message to provide context about what is being loaded, especially if the loading time is long."
          ],
          "id": "content",
          "name": "Content"
        },
        {
          "content": [
            "Maintain consistency in size and style; avoid using spinners of varying sizes on the same page."
          ],
          "id": "styling",
          "name": "Styling"
        }
      ],
      "useCases": [
        "Indicate that content is being loaded, such as when fetching data from a server or loading a new page.",
        "Show ongoing background processes, like file uploads or data processing tasks.",
        "Used within buttons or interactive elements to indicate that an action is being processed.",
        "Apply to sections of a page that are loading independently, such as widgets or panels.",
        "Display when a form is being submitted to show that the submission is in progress."
      ]
    },
    "sourceModulePath": "components/spinner/spinner.js",
    "summary": "Spinners are used to show the progress of an indeterminate operation."
  },
  "id": "component:syn-spinner",
  "kind": "component",
  "layers": {
    "examples": [
      {
        "layer": "examples",
        "path": "layers/examples/component/component:syn-spinner.md"
      }
    ],
    "full": [
      {
        "layer": "full",
        "path": "layers/full/component/component:syn-spinner/angular/spinner.component.ts"
      },
      {
        "layer": "full",
        "path": "layers/full/component/component:syn-spinner/components/spinner.component.ts"
      },
      {
        "layer": "full",
        "path": "layers/full/component/component:syn-spinner/components/spinner.custom.styles.ts"
      },
      {
        "layer": "full",
        "path": "layers/full/component/component:syn-spinner/components/spinner.styles.ts"
      },
      {
        "layer": "full",
        "path": "layers/full/component/component:syn-spinner/components/spinner.ts"
      },
      {
        "layer": "full",
        "path": "layers/full/component/component:syn-spinner/react/spinner.ts"
      },
      {
        "layer": "full",
        "path": "layers/full/component/component:syn-spinner/vue/SynVueSpinner.vue"
      },
      {
        "layer": "full",
        "path": "layers/full/component/component:syn-spinner/react/SynSpinnerJSXElement.ts"
      }
    ],
    "interface": [
      {
        "layer": "interface",
        "path": "layers/interface/component/component:syn-spinner.json"
      },
      {
        "layer": "interface",
        "path": "layers/interface/component/component:syn-spinner.md"
      }
    ],
    "rules": [
      {
        "layer": "rules",
        "path": "layers/rules/component/component:syn-spinner.md"
      }
    ]
  },
  "name": "syn-spinner",
  "package": "components",
  "relations": [],
  "since": "1.22.0",
  "sources": [
    "packages/angular/components/spinner/spinner.component.ts",
    "packages/components/src/components/spinner/spinner.component.ts",
    "packages/components/src/components/spinner/spinner.custom.styles.ts",
    "packages/components/src/components/spinner/spinner.styles.ts",
    "packages/components/src/components/spinner/spinner.ts",
    "packages/react/src/components/spinner.ts",
    "packages/vue/src/components/SynVueSpinner.vue"
  ],
  "status": "stable",
  "tags": [
    "angular",
    "component",
    "react",
    "spinner",
    "syn-spinner",
    "vue"
  ]
}
